Began_Year,Began_Weekday_abbr,Began_Weekday,Began_Week_Num,Began_Month ,Date_Event_Began,Time_Event _Began,Date_Restoration,Time_Restoration,Duration_Day,Duration_min,Respondent,Area_Affected,NERC_Region,Alert_Criteria,Event_Type,Demand_Loss_MW,Num_Customers_Affected
2008,Tue,Tuesday,25,June,6/17/08,20:35,6/18/08,1:55,2,,Southwestern Public Service Company ,Southwestern Public Service Company Operating in the Panhandle of Texas and New Mexico,SPP,,Electrical System Separation/Severe Thunderstorms,560.0,18000
2008,Tue,Tuesday,25,June,6/17/08,20:40,6/17/08,23:00,1,,"Golden Spread Electric Cooperative, Inc ","Texas Panhandle and Texas South Plains Regions, and Oklahoma Panhandle",TRE,,Thunderstorms/Uncontrolled Loss of Load,276.0,37330
2008,Sat,Saturday,25,June,6/21/08,15:09,6/21/08,18:53,0,,Pacific Gas and Electric Company ,"Near Rogers Flat, California",WECC,,Electrical System Separation/Severe Lightning Storms,3.0,477
2008,Sun,Sunday,26,June,6/22/08,16:55,6/22/08,17:05,0,,Northern Indiana Public Service Company ,Northwest Indiana,RFC,,Lightning Stirke/Uncontrolled Loss of Load,650.0,-
2008,Mon,Monday,26,June,6/23/08,13:44,6/23/08,13:45,1,,Northern Indiana Public Service Company ,Northcentral Indiana,RFC,,Fire/Breaker Failure,425.0,-
2008,Mon,Monday,26,June,6/23/08,16:52,6/23/08,23:28,1,,Progress Energy Florida ,"Pinellas County, Florida",FRCC,,Transmission Equipment Failure/Load Shedding,113.0,32593
2008,Thu,Thursday,26,June,6/26/08,17:00,6/26/08,21:30,1,,Detroit Edison Company-DTE ,Southeastern Michigan (DTE Service Territory),RFC,,Thunderstorms,-,53000
2008,Fri,Friday,26,June,6/27/08,16:30,6/27/08,17:30,1,,Omaha Public Power District ,"Omaha, Nebraska (Metro Area)",MRO,,Severe Wind Storm,650.0,126000
2008,Tue,Tuesday,27,July,7/1/08,7:31,7/1/08,12:00,1,,Crockett Cogeneration ,"San Francisco Bay Area, California",WECC,,Unit Tripped,160.0,-
2008,Wed,Wednesday,27,July,7/2/08,15:00,7/6/08,12:00,3,,Consumers Energy ,Lower 2/3 of Michigan's Lower Peninsula,RFC,,Severe Weather,125.0,239663
2008,Wed,Wednesday,27,July,7/2/08,19:16,7/2/08,23:28,1,,California ISO ,"Santa Barbara County, California, near Goleta",WECC,,Wild Land Fire,208.0,200000
2008,Wed,Wednesday,27,July,7/2/08,19:36,7/3/08,1:10,2,,Southern California Edison ,Goleta and Santa Barbara Areas of Southern California,WECC,,Brush Fire/Lines Loss/Transmission Emergency Declared,119.0,37784
2008,Wed,Wednesday,27,July,7/2/08,20:00,7/3/08,3:00,2,,Detroit Edison Company-DTE ,Southeastern Michigan (DTE Service Territory),RFC,,Thunderstorms,-,56000
2008,Mon,Monday,28,July,7/7/08,12:15,7/10/08,17:00,4,,California ISO ,ISO Balancing Area,WECC,,Heat Wave/Potential Fire Threat/Made Public Appeals,0.0,0
2008,Thu,Thursday,28,July,7/10/08,14:22,7/10/08,17:21,1,,Crockett Cogeneration ,"San Francisco Bay Area, California",WECC,,Unit Tripped,240.0,-
2008,Mon,Monday,30,July,7/21/08,0:49,7/22/08,18:00,2,,MidAmercian Energy Company ,"Sioux City, Carroll, Des Moines, Iowa City, and Davenport Iowa, Rock Island, Moline, and Surrounding Area of Illinois",MRO,,Storm,170.0,185000
2008,Tue,Tuesday,30,July,7/22/08,3:00,7/24/08,19:32,3,,Duke Energy Indiana ,Indiana,RFC,,Severe Thunderstorms,-,58000
2008,Tue,Tuesday,30,July,7/22/08,3:00,7/23/08,3:30,2,,Duke Energy Ohio ,Southwest Ohio,RFC,,Severe Thunderstorms,-,56000
2008,Tue,Tuesday,30,July,7/22/08,14:00,7/24/08,5:09,3,,Southwestern Public Service Company ,Texas Panhandle and Southeastern New Mexico,SPP,,Indequate Electric Resources to Serve Load/Public Appeal,-,-
2008,Wed,Wednesday,30,July,7/23/08,5:56,7/31/08,4:00,7,,American Electric Power ,"Port Isabel, Harlingen, Weslaco, Pharr, San Benito, Mission, McAllen, Edinburg, Texas",TRE,,Hurricane Dolly,703.0,211266
2008,Thu,Thursday,30,July,7/24/08,7:23,7/24/08,17:41,1,,ISO New England ,"Bangor Hydro System, northern Maine",NPCC,,Electric System Separation/Severe Lightning Storms,180.0,110000
2008,Sat,Saturday,31,August,8/2/08,20:00,8/3/08,5:30,0,,Southern Company ,Georgia and Alabama,SERC,,Severe Thunderstorms,400.0,131115
2008,Sun,Sunday,32,August,8/3/08,1:30,8/3/08,4:15,0,,Entergy Corporation ,"Mississippi, Louisiana, Texas",SERC,,Severe Thunderstorms,-,59500
2008,Mon,Monday,32,August,8/4/08,18:00,8/6/08,8:00,3,,Exelon Corporation West ComEd ,The ComEd Territory,RFC,,Severe Weather,-,653000
2008,Tue,Tuesday,32,August,8/5/08,3:00,8/5/08,9:50,1,,Northern Indiana Public Service Company ,Northwest Indiana,RFC,,Severe Storms,0.0,63000
2008,Sat,Saturday,32,August,8/9/08,12:00,8/9/08,20:46,0,,XCEL ,Texas Panhandle and Eastern New Mexico,Southwest Public Service Company ,,Declared Energy Emergency Alert 1/Made Public Appeals,0.0,0
2008,Fri,Friday,33,August,8/15/08,12:52,8/15/08,17:00,1,,Seattle City Light ,Part of Seattle's Downtown,WECC,,Made Public Appeals,100.0,8000
2008,Sat,Saturday,33,August,8/16/08,5:23,8/16/08,7:30,0,,Lubbock Power and Light ,City of Lubbock,TRE,,Lightning/Transmission Equipment Damage,153.0,71823
2008,Sat,Saturday,33,August,8/16/08,8:14,8/18/08,15:00,1,,Puerto Rico Electric Power Authority ,Island of Puerto Rico,PR,,Shed Firm Load/Voltage Reduction,300.0,200000
2008,Mon,Monday,34,August,8/18/08,19:22,8/19/08,18:44,2,,Puerto Rico Electric Power Authority ,North Part of Island,PR,,Shed Firm Load,225.0,100000
2008,Tue,Tuesday,34,August,8/19/08,9:29,8/22/08,22:00,4,,Florida Power and Light ,Florida,FRCC,,Tropical Storm Fay,-,101950
2008,Thu,Thursday,34,August,8/21/08,19:00,8/25/08,8:00,3,,Progress Energy Florida ,"Alachua, Bay, Brevard, Citrus, Columbia, Dixie, Flagler, Franklin, Gilchrist, Gulf, Hamilton, Hardee, Hernando, Highlands, Jefferson, Lafayette, Lake, Leon, Levy, Madison, Marion, Orange, Osceola, Pasco, Pinellas, Polk, Seminole, Sumter,  Suwannee, Taylor, Volusia and Wakulla Counties in Florida",FRCC,,Tropical Storm Fay,-,430000
2008,Fri,Friday,34,August,8/22/08,12:00,8/23/08,12:00,1,,Mirant Chalk Point LLC ,-,RFC,,Fuel Supply Emergency-Low Coal Inventory Levels,0.0,0
2008,Sun,Sunday,35,August,8/24/08,4:30,8/24/08,14:00,0,,Southern Company ,Georgia and Alabama,SERC,,Tropical Storm Fay,110.0,87390
2008,Sun,Sunday,36,August,8/31/08,7:30,9/19/08,9:00,15,,Dow Chemical Company ,"Plaquemine, Louisiana",SERC,,Fuel Supply Curtailed,200.0,0
2008,Sun,Sunday,36,August,8/31/08,19:00,9/3/08,9:00,3,,Entergy Corporation ,"Louisiana, Mississippi, Arkansas",SERC,,Hurricane Gustav,-,964000
2008,Mon,Monday,36,September,9/1/08,10:30,9/13/08,19:22,10,,Louisiana Generating LLC ,Primarily South and Central Louisiana,SERC,,Hurricane Gustav,400.0,150000
2008,Mon,Monday,36,September,9/1/08,11:45,9/10/08,16:00,8,,Cleco Power LLC ,"Bayou Division and North Lake Division, Louisiana",SERC,,Hurricane Gustav,-,246092
2008,Sat,Saturday,36,September,9/6/08,7:45,9/6/08,10:30,0,,Progress Energy Carolinas ,Eastern North Carolina,SERC,,Tropical Storm Hanna,-,57000
2008,Sat,Saturday,36,September,9/6/08,14:15,9/6/08,16:06,0,,Dominion-Virginia Power ,North East North Carolina and Virginia,SERC,,Tropical Storm Hanna,220.0,64463
2008,Mon,Monday,37,September,9/8/08,22:03,9/9/08,0:28,2,,"State of California, Department of Water Resources ",A.D. Edmonston Pumping Plant,WECC,,Fuel Supply Deficiency,300.0,0
2008,Fri,Friday,37,September,9/12/08,5:45,9/14/08,13:00,1,,Entergy Corporation ,"Primarily Southeast Texas, Louisiana, and Arkansas",SERC,,Hurricane Ike,-,705000
2008,Fri,Friday,37,September,9/12/08,18:21,10/1/08,23:59,14,,CenterPoint Energy ,Greater Houston-Galveston Metro Area,TRE,,Hurricane Ike,8087.0,2142678
2008,Fri,Friday,37,September,9/12/08,18:21,10/1/08,23:59,14,,Electric Reliability Council of Texas ,Greater Houston Area-Eastern Region of ERCOT,TRE,,Hurricane Ike,-,2504366
2008,Fri,Friday,37,September,9/12/08,20:00,9/27/08,19:00,11,,Texas New Mexico Power Company ,Galveston and Brazoria Counties,TRE,,Hurricane Ike,650.0,113247
2008,Sat,Saturday,37,September,9/13/08,10:24,9/27/08,14:40,10,,Louisiana Generating LLC ,Southwest Louisiana,SERC,,Hurricane Ike,40.0,50000
2008,Sat,Saturday,37,September,9/13/08,12:00,9/15/08,8:00,1,,Oncor Electric Delivery Company LLC ,"North, Central and East Texas",TRE,,Hurricane Ike,-,238392
2008,Sat,Saturday,37,September,9/13/08,16:00,9/16/08,19:44,2,,American Electric Power CSWS ,Texas and Louisana,SPP,,Hurricane Ike,-,184501
2008,Sun,Sunday,38,September,9/14/08,6:30,9/14/08,14:38,0,,Midwest ISO ,"Ohio, Kentucky, Indiana",RFC,,Tropical Depression Ike,-,875000
2008,Sun,Sunday,38,September,9/14/08,7:30,9/18/08,15:00,4,,Ameren Corporation ,Missouri and Illinois,MRO,,Hurricane Ike,-,107000
2008,Sun,Sunday,38,September,9/14/08,10:01,9/21/08,17:00,5,,Owensboro Municipal Utilities ,"City of Owensboro, Kentucky",RFC,,High Winds,70.0,18000
2008,Sun,Sunday,38,September,9/14/08,11:30,9/14/08,16:30,0,,Louisville Gas/Kentucky Utilities ,State of Kentucky,RFC,,Tropical Depression Ike,-,375000
2008,Sun,Sunday,38,September,9/14/08,14:00,9/17/08,12:00,3,,Dayton Power and Light ,Dayton Ohio Area,RFC,,Hurricane Ike,1000.0,95000
2008,Sun,Sunday,38,September,9/14/08,16:00,9/20/08,23:00,5,,American Electric Company ,"Northern Indiana, Central and Central Southern Ohio",RFC,,Wind Storm,-,650000
2008,Sun,Sunday,38,September,9/14/08,17:00,9/19/08,12:38,5,,Pennsylvania Electric Company ,Western Pennsylvania,RFC,,Wind Storm,72.0,124596
2008,Sun,Sunday,38,September,9/14/08,17:00,9/22/08,17:11,6,,Ohio Edison Company ,"Southern, Eastern, and Central Ohio",RFC,,Wind Storm,469.0,564728
2008,Sun,Sunday,38,September,9/14/08,17:00,9/22/08,3:20,6,,Cleveland Electric Illuminating Company ,Northeast Ohio,RFC,,Wind Storm,430.0,245164
2008,Sun,Sunday,38,September,9/14/08,19:00,9/14/08,23:59,0,,Duquesne Light Company ,Allegheny and Beaver Counties in Pennsylvania,RFC,,Tropical Depression Ike,600.0,105000
2008,Mon,Monday,38,September,9/15/08,0:37,9/19/08,16:30,5,,Allegheny Power ,Western Pennsylvania,RFC,,Tropical Depression Ike,546.0,160875
2008,Mon,Monday,39,September,9/22/08,17:49,9/22/08,6:39,1,,Puerto Rico Electric Power Authority ,Island of Puerto Rico,PR,,Shed Firm Load,125.0,43600
2008,Tue,Tuesday,40,September,9/30/08,14:02,9/30/08,14:05,1,,Pacific Gas and Electric Company ,"Plumas County, California",WECC,,Electrical System Separation,30.0,10000
2008,Thu,Thursday,40,October,10/2/08,14:50,10/2/08,9:50,1,,Dow Chemical Company ,Louisiana,SERC,,Load Shedding,200.0,0
2008,Sat,Saturday,43,October,10/25/08,23:00,10/27/08,7:00,1,,ISO New England ,Connecticut,NPCC,,Severe Storm,-,52000
2008,Fri,Friday,45,November,11/7/08,11:13,11/7/08,11:54,1,,Southern California Edison ,Goleta and Santa Barbara Areas of Southern California,WECC,,Load Shedding,250.0,140000
2008,Fri,Friday,45,November,11/7/08,11:15,11/7/08,11:54,1,,California ISO ,Southern California,WECC,,Load Shedding,430.0,400000
2008,Tue,Tuesday,46,November,11/11/08,8:30,11/11/08,0:19,1,,Puerto Rico Electric Power Authority ,Island of Puerto Rico,PR,,Shed Firm Load,250.0,261000
2008,Sat,Saturday,46,November,11/15/08,9:39,11/15/08,10:10,0,,Los Angeles Department of Water and Power ,City of Los Angeles,WECC,,Brush Fire/Shed Firm Load,211.0,115500
2008,Tue,Tuesday,49,December,12/2/08,4:30,12/2/08,7:00,1,,Midwest ISO ,"St. Louis, Missouri",RFC,,Fire/Load Shedding,135.0,53000
2008,Tue,Tuesday,50,December,12/9/08,17:27,12/10/08,4:12,2,,Jersey Central Power and Light ,Central New Jersey,RFC,,Lines Loss/Transmission,438.0,156729
2008,Wed,Wednesday,50,December,12/10/08,17:09,12/10/08,20:29,1,,PacifiCorp ,Southern Oregon,WECC,,Equipment Failure/Made Public Appeal,32.0,3
2008,Thu,Thursday,50,December,12/11/08,9:00,12/13/08,23:59,2,,Entergy Corporation ,"Southern Louisiana, Southern and Central Mississippi",SERC,,Snow Storm,-,91300
2008,Thu,Thursday,50,December,12/11/08,18:00,12/15/08,0:00,3,,Central Hudson Gas and Electric ,Northern Dutchess County and Western Ulster County in the Mid-Hudson Region of New York State,NPCC,,Ice Storm,-,60000
2008,Fri,Friday,50,December,12/12/08,1:00,12/22/08,0:00,7,,ISO New England ,New England,NPCC,,Ice Storm,-,970000
2008,Fri,Friday,50,December,12/12/08,2:38,12/19/08,13:24,6,,National Grid ,Eastern New York,NPCC,,Ice Storm,200.0,190000
2008,Fri,Friday,50,December,12/12/08,8:45,12/14/08,9:52,1,,Central Maine Power Company ,Southern and Central Maine,NPCC,,Ice Storm,-,169757
2008,Sat,Saturday,50,December,12/13/08,15:30,12/21/08,9:17,5,,Pacific Gas and Electric Company ,Humboldt Area of California,WECC,,Declared Stage 1 Electric Emergency/Made Public Appeal,5.0,0
2008,Fri,Friday,51,December,12/19/08,1:02,12/19/08,6:17,1,,Pacific Gas and Electric Company ,"East of Oroville, California",WECC,,Electrical System Separation,1.0,638
2008,Fri,Friday,51,December,12/19/08,8:30,12/22/08,12:00,2,,American Electric Power ,"Indiana, Michigan and Northwest Ohio",RFC,,Ice Storm,-,140000
2008,Fri,Friday,51,December,12/19/08,9:00,12/20/08,8:20,1,,Midwest ISO ,Northwest Indiana,RFC,,Ice Storm,-,50000
2008,Fri,Friday,52,December,12/26/08,11:40,12/26/08,15:34,1,,Sacramento Municipal Utility District ,"Orangevale Area of Sacramento, California",WECC,,Load Shedding,110.0,50000
2008,Fri,Friday,52,December,12/26/08,18:13,12/27/08,17:00,1,,"Hawaiian Electric Company, Inc. ","Island of Oahu, Hawaii",HI,,Lightning,1060.0,294000
2008,Sat,Saturday,52,December,12/27/08,16:00,1/1/09,23:30,4,,DTE Energy ,Southeastern Michigan,RFC,,Wind Storm,-,247847
2008,Sun,Sunday,53,December,12/28/08,4:45,12/31/08,18:00,3,,Consumers Energy ,Michigan Lower Peninsula,RFC,,Wind Storm,-,210517
2008,Sun,Sunday,53,December,12/28/08,11:45,12/28/08,23:30,0,,Midwest ISO ,Michigan Lower Peninsula,RFC,,Wind Storm,-,230000
2008,Tue,Tuesday,53,December,12/30/08,16:02,12/30/08,16:37,1,,Crawfordsville Electric Light and Power ,"Crawfordsville, Indiana",RFC,,Shed Firm Load,41.0,9700
2007,Fri,Friday,1,January,1/5/07,10:44,1/5/07,11:13,1,,Puerto Rico Electric Power Authority ,Island of Puerto Rico,PR,,Voltage Reduction,0.0,0
2007,Sat,Saturday,2,January,1/13/07,5:00,1/19/07,12:00,5,,Ameren Corporation ,Missouri and Illinois,MRO,,Ice Storm,-,225000
2007,Sat,Saturday,2,January,1/13/07,7:30,1/19/07,16:00,5,,DTE Energy ,Eastern and Lower Michigan,Detroit Edison ,,Ice Storm,500.0,129607
2007,Tue,Tuesday,3,January,1/16/07,2:00,1/17/07,0:00,2,,Snohomish County PUD No. 1 ,"Snohomish County, Washington",WECC,,Major Windstorm,260.0,110433
2007,Tue,Tuesday,7,February,2/13/07,14:00,2/16/07,0:00,4,,Duke Energy Midwest ,Indiana and Southwest Ohio,RFC,,Ice/Wind Storm,250.0,367500
2007,Tue,Tuesday,7,February,2/13/07,17:00,2/17/07,5:30,4,,Baltimore Gas and Electric Company ,Central Maryland,RFC,,Winter Storm,400.0,155183
2007,Sat,Saturday,8,February,2/24/07,16:00,3/4/07,0:57,5,,MidAmerican Energy Company ,"NE quarter of State of Iowa and Rock Island, Illinois",MRO,,Ice Storm,210.0,75000
2007,Sat,Saturday,8,February,2/24/07,18:00,2/24/07,23:47,0,,Alliant Energy ,Central Iowa and Cedar Rapids areas,MRO,,Ice Storm,400.0,140000
2007,Sat,Saturday,8,February,2/24/07,19:23,2/25/07,0:47,0,,Midwest ISO ,"Cedar Rapids, Iowa",RFC,,Ice Storm,750.0,215000
2007,Wed,Wednesday,9,February,2/28/07,0:45,3/2/07,20:45,3,,Pacific Gas and Electric Company ,Northern California,WECC,,Winter Storm,110.0,671189
2007,Thu,Thursday,9,March,3/1/07,21:40,3/2/07,23:30,2,,Southern Company ,"Parts of Alabama, Mississippi, Georgia, Florida",SERC,,Major Storm,95.0,25445
2007,Sat,Saturday,13,March,3/31/07,7:30,3/31/07,19:00,0,,CenterPoint Energy ,"Houston, Texas",ERCOT,,Severe Thunderstorms,179.0,67000
2007,Thu,Thursday,14,April,4/5/07,21:20,4/6/07,13:10,2,,Central Maine Power Company ,Southern and Coastal Maine,NPCC,,Heavy Snow Storm,-,117142
2007,Thu,Thursday,15,April,4/12/07,0:32,4/12/07,21:02,1,,Los Angeles Department of Water and Power ,"City of Los Angeles, California",WECC,,High Winds,200.0,158977
2007,Thu,Thursday,15,April,4/12/07,9:09,4/12/07,11:23,1,,Crockett Cogeneration ,"San Francisco Bay Area, California",WECC,,Trip of a Unit,130.0,-
2007,Sat,Saturday,15,April,4/14/07,9:00,4/14/07,11:00,0,,National Grid - New England ,"Massachusetts, New Hampshire, Rhode Island",NPCC,,High Winds,80.0,70000
2007,Mon,Monday,16,April,4/16/07,8:00,4/16/07,19:00,1,,Public Service New Hampshire Electric System Control Center ,New Hampshire,NPCC,,Severe Thunderstorms,-,102568
2007,Mon,Monday,16,April,4/16/07,10:14,4/18/07,22:18,3,,Central Maine Power Company ,Southern and Coastal Maine,NPCC,,Heavy Snow Storm,-,127545
2007,Mon,Monday,16,April,4/16/07,11:00,4/16/07,19:00,1,,"Progress Energy - Carolinas, Inc. ",North and South Carolina,SERC,,HIgh Winds,-,33000
2007,Mon,Monday,16,April,4/16/07,14:00,4/18/07,17:00,3,,Baltimore Gas and Electric Company ,Central Maryland - Baltimore City and surrounding Counties,RFC,,Severe Thunderstorms,160.0,138000
2007,Mon,Monday,16,April,4/16/07,14:04,4/16/07,19:03,1,,Dominion - Virginia Power/North Carolina ,"North, East and Central Virginia/Parts of Northeast North Carolina",SERC,,High Winds,90.0,242000
2007,Wed,Wednesday,18,May,5/2/07,13:30,5/3/07,20:00,2,,Oncor Electric Delivery Company ,"North Texas, Dallas Fort Worth Metroplex and Surrounding Counties, South to Waco and North to Red River",ERCOT,,Severe Storms,-,300000
2007,Thu,Thursday,19,May,5/10/07,9:57,5/10/07,13:47,1,,Crockett Cogeneration ,"San Francisco Bay Area, California",WECC,,Unit Tripped,150.0,-
2007,Mon,Monday,20,May,5/14/07,11:15,5/14/07,13:50,1,,Crockett Cogeneration ,"San Francisco Bay Area, California",WECC,,Unit Tripped,150.0,-
2007,Tue,Tuesday,20,May,5/15/07,15:00,5/17/07,7:00,3,,DTE Energy ,Southeastern Michigan,Detroit Edison ,,Severe Thunderstorms,500.0,66000
2007,Wed,Wednesday,20,May,5/16/07,18:00,5/19/07,5:00,3,,Northeast Utilities ,All of Connecticut,NPCC,,Severe Storm,-,67000
2007,Mon,Monday,21,May,5/21/07,13:48,5/21/07,16:50,1,,Crockett Cogeneraton ,"San Franscisco Bay Area, California",WECC,,Unit Tripped,140.0,-
2007,Tue,Tuesday,23,June,6/5/07,10:56,6/5/07,11:51,1,,Idaho Power Company ,Southwest Idaho and Eastern Oregon,WECC,,Load Shedding,424.0,80000
2007,Wed,Wednesday,26,June,6/27/07,15:41,6/27/07,16:30,1,,Consolidated Edison of NY Inc ,"Northern Manhattan NY (Yorkville) and SW Bronx (Motthaven, Melrose, High Bridge Sections)",NPCC,,Lightning,460.0,137000
2007,Wed,Wednesday,26,June,6/27/07,15:42,6/27/07,16:30,1,,New York Independent System Operator ,New York State,NPCC,,Loss of Load,460.0,-
2007,Fri,Friday,26,June,6/29/07,9:23,6/29/07,10:09,1,,Salt River Project ,Metropolitan Phoenix Area,WECC,,Loss of Load,399.0,98700
2007,Tue,Tuesday,27,July,7/3/07,10:59,7/5/07,18:00,3,,California Independent System Operator ,CAISO Controlled Grid,WECC,,Public Appeal,-,-
2007,Thu,Thursday,27,July,7/5/07,19:00,7/8/07,7:00,2,,DTE Energy ,Southeastern Michigan,Detroit Edison ,,Severe Storm,-,69000
2007,Fri,Friday,27,July,7/6/07,17:18,7/6/07,18:20,1,,Idaho Power Company ,Southeast Idaho and Eastern Oregon,WECC,,Electrical Separation/Load Shedding/Made Public Appeal,60.0,0
2007,Tue,Tuesday,28,July,7/10/07,11:00,7/12/07,6:00,3,,National Grid - NY ,Eastern New York,NPCC,,Major Storms,650.0,300000
2007,Mon,Monday,29,July,7/16/07,16:17,7/16/07,21:00,1,,PacifiCorp ,"St. George, Utah",WECC,,Fire/Load Shedding,306.0,-
2007,Wed,Wednesday,29,July,7/18/07,18:00,7/19/07,2:00,2,,Exelon Corporation West ComEd ,Northern Counties of Illinois,RFC,,Severe Weather,300.0,135000
2007,Thu,Thursday,29,July,7/19/07,15:00,7/22/07,23:30,2,,DTE Energy ,Southwestern Region of Service Territory,Detroit Edison ,,Major Storm,-,60000
2007,Thu,Thursday,29,July,7/19/07,15:50,7/19/07,22:15,1,,Dominion - Virginia Power/North Carolina Power ,"North, East and Central Virginia",SERC,,Major Storms,72.0,107000
2007,Wed,Wednesday,32,August,8/8/07,13:00,8/8/07,21:00,1,,"Progress Energy - Carolinas, Inc. ",Portions of North Carolina and South Carolina,SERC,,Made Public Appeal,-,-
2007,Wed,Wednesday,32,August,8/8/07,15:56,8/8/07,17:59,1,,PJM Interconnection ,Mid-Altantic Region of PJM,RFC,,Voltage Reduction/Made Public Appeal,-,-
2007,Thu,Thursday,32,August,8/9/07,12:45,8/9/07,21:00,1,,"Progress Energy - Carolinas, Inc. ",Portions of North Carolina and South Carolina,SERC,,Made Public Appeal,-,-
2007,Thu,Thursday,32,August,8/9/07,14:53,8/9/07,16:11,1,,Duquesne Light Company ,"Highland Area of Pittsburgh, Pennsylvania",RFC,,Severe Thunderstorms,90.0,55000
2007,Fri,Friday,32,August,8/10/07,12:20,8/10/07,21:00,1,,"Progress Energy - Carolinas, Inc. ",Portions of North Carolina and South Carolina,SERC,,Made Public Appeal,-,-
2007,Mon,Monday,33,August,8/13/07,1:30,8/14/07,0:00,2,,Ameren Corporation ,State of Missouri,SERC,,Severe Thunderstorm,-,63000
2007,Tue,Tuesday,33,August,8/14/07,14:00,8/14/07,18:00,1,,American Electric Power ,"CSWS Control Area of Southwest Power Pool Parts of Oklahoma, Texas, Louisiana, Arkansas",CSWS ,,Declared Energy Emergency Alert2/Heat Wave,20.0,-
2007,Thu,Thursday,33,August,8/16/07,21:30,8/17/07,22:49,2,,Dominion Virginia Power ,Virginia and Eastern North Carolina - Primarily in Central Virginia,SERC,,Severe Weather,200.0,93300
2007,Sun,Sunday,34,August,8/19/07,23:34,8/20/07,1:10,1,,Dominion Virginia Power ,Central and Eastern Virginia,SERC,,Severe Thunderstorms,100.0,58500
2007,Thu,Thursday,34,August,8/23/07,16:00,8/28/07,22:49,4,,Exelon Corporation West ComEd ,Northern Illinois,RFC,,Severe Storms,-,629590
2007,Fri,Friday,34,August,8/24/07,18:00,8/28/07,6:30,3,,DTE Energy ,Southeastern Michigan,Detroit Edison ,,Severe Storm,-,75000
2007,Wed,Wednesday,35,August,8/29/07,13:53,8/29/07,14:57,1,,Modesto Irrigation District ,Modesto California and the Surrounding Areas,WECC,,Shed Load,180.0,26000
2007,Wed,Wednesday,35,August,8/29/07,16:00,8/30/07,18:00,2,,California Independent System Operator ,CAISO Controlled Grid,WECC,,Made Public Appeal,-,-
2007,Fri,Friday,35,August,8/31/07,12:45,8/31/07,20:00,1,,California Independent System Operator ,CAISO Controlled Grid,WECC,,Declared Energy Emergency Alert 1/Heat wave,-,-
2007,Mon,Monday,36,September,9/3/07,12:30,9/3/07,17:30,1,,San Diego Gas and Electric Company ,"San Diego County, Southern Orange County, California",WECC,,High Temperatures/Made Public Appeals,-,-
2007,Tue,Tuesday,36,September,9/4/07,8:30,9/4/07,15:30,1,,San Diego Gas and Electric Company ,"San Diego County, Southern Orange County, California",WECC,,High Temperatures/Made Public Appeals,-,-
2007,Wed,Wednesday,36,September,9/5/07,7:53,9/5/07,13:11,1,,"Luminant Energy Company, LLC ","Central Texas, ERCOT Grid",ERCOT,,Severe Weather/Transmission Fault-Units Tripped,1084.0,-
2007,Thu,Thursday,37,September,9/13/07,4:00,9/14/07,7:00,2,,Entergy Corporation ,"Between Galveston and Beaumont, Texas",SPP,,Hurricane Humberto,-,118000
2007,Mon,Monday,38,September,9/17/07,19:01,9/17/07,19:48,1,,Crawfordsville Electric Light and Power ,"City of Crawfordsville, Indiana",RFC,,Electrical System Separation,50.0,9600
2007,Tue,Tuesday,38,September,9/18/07,5:14,9/18/07,6:10,1,,Northern States Power Company ,"Minnesota, Wisconsin, North Dakota, South Dakota and Michigan",MRO,,Electrical System Separation/Load Shedding/ Implemented Emergency Alert/Severe Storms,16.0,6000
2007,Tue,Tuesday,38,September,9/18/07,5:15,9/18/07,6:30,1,,Great River Energy ,"Minnesota, North Dakota, Manitoba",MRO,,Electrical System Separation/Load Shedding/ Implemented Emergency Alert/Severe Storms,10000.0,11175
2007,Tue,Tuesday,38,September,9/18/07,5:15,9/18/07,0:00,1,,Midwest ISO ,"Manitoba, Minnesota, North Dakota, Portions of South Dakota and Wisconsin.  Midwest ISO's Market subregions: OTP, NSP, GRE, ALTW, MP",RFC,,Electrical System Separation/Load Shedding/ Implemented Emergency Alert/ Severe Storms,10000.0,11175
2007,Mon,Monday,39,September,9/24/07,13:38,9/24/07,16:26,1,,"New Covert Generating Company, LLC ",Southwest Michigan,RFC,,Unit Tripped,320.0,-
2007,Thu,Thursday,42,October,10/18/07,15:00,10/22/07,11:36,3,,Puget Sound Energy ,Western Washington,WECC,,High Winds,-,160000
2007,Mon,Monday,43,October,10/22/07,14:01,10/22/07,14:22,1,,Southern California Edison Company ,Southern California,WECC,,Brush Fire/Load Shedding/Implemented Emergency Alert,451.0,90323
2007,Mon,Monday,43,October,10/22/07,14:05,10/22/07,14:22,1,,California Independent System Operator ,Southern California,WECC,,Brush Fire/Load Shedding,700.0,300000
2007,Mon,Monday,43,October,10/22/07,14:06,10/22/07,14:43,1,,San Diego Gas and Electric Company ,"San Diego County, California",WECC,,Brush Fire/Load Shedding,199.0,68780
2007,Fri,Friday,43,October,10/26/07,6:44,10/26/07,10:46,1,,Southern California Edison Company ,Southern Califonia,WECC,,Brush Fire/Load Shedding,280.0,20345
2007,Fri,Friday,43,October,10/26/07,6:44,10/26/07,10:43,1,,City of Riverside ,"Riverside, California",WECC,,Load Shedding,240.0,104000
2007,Sat,Saturday,44,November,11/3/07,18:00,11/4/07,6:00,0,,ISO New England ,"Eastern Massachusetts, Rhode Island, Cape Cod",NPCC,,Tropical Storm,100.0,62843
2007,Sat,Saturday,48,December,12/1/07,18:04,12/2/07,22:00,0,,ISO New England ,State of Maine,NPCC,,Voltage Reduction/Made Public Appeal/Fuel Deficiency,0.0,0
2007,Tue,Tuesday,49,December,12/4/07,14:16,12/4/07,17:53,1,,Puerto Rico Electric Power Authority ,Island of Puerto Rico,PR,,Voltage Reduction,0.0,0
2007,Mon,Monday,50,December,12/10/07,3:08,12/19/07,8:00,8,,American Electric Power ,"Tulsa, Oklahoma",SPP,,Ice Storm,-,256663
2007,Tue,Tuesday,50,December,12/11/07,4:00,12/20/07,15:30,8,,Westar Energy ,Eastern half of the State of Kansas,MRO,,Ice Storm,500.0,95000
2007,Tue,Tuesday,50,December,12/11/07,20:57,12/11/07,21:22,1,,Puerto Rico Electric Power Authority ,Island of Puerto Rico,PR,,Voltage Reduction,0.0,0
2007,Sun,Sunday,52,December,12/23/07,1:00,12/23/07,21:00,0,,Exelon Corporation West ComEd ,The Entire ComEd Service Territory,RFC,,Severe Storm,-,237000
2007,Sun,Sunday,52,December,12/23/07,5:30,12/25/07,18:07,2,,Consumers Energy ,Lower 2/3 of Michigan Lower Peninsula,RFC,,Winter Storm,50.0,134288
